{
  "$schema": "http://json-schema.org/draft-07/schema#",
  "title": "VESSEL Room Template",
  "type": "array",
  "items": {
    "type": "object",
    "additionalProperties": false,
    "required": ["id", "type", "intensity", "allowsCombatLock"],
    "properties": {
      "id": { "type": "string", "minLength": 1 },
      "type": { "type": "string", "enum": ["start", "boss", "combat", "altar", "confession", "reliquary", "rest"] },
      "intensity": { "type": "number", "minimum": 0, "maximum": 10 },
      "allowsCombatLock": { "type": "boolean" },
      "notes": { "type": "string" }
    }
  }
}
